{
  "registry_version": "1.0.0",
  "model_alias": "jev-latest",
  "status": "evaluation_only",
  "questions": [
    {
      "id": "destination.completeness",
      "version": "1.0.0",
      "owner_engine": "Destination",
      "type": "score",
      "instructions": "How complete and actionable is the owner destination while preserving uncertainty?",
      "criteria": [
        "Vague aspiration with essential dimensions absent",
        "Partially specified with several material unknowns",
        "Actionable but still has material unknowns",
        "Specific and ready for scenario exploration"
      ],
      "maximum_authority": "signal_only",
      "fallback": "owner_clarification",
      "consent_purpose": "destination_quality_evaluation",
      "threshold_policy": "display-only-v1",
      "examples": [
        {
          "name": "specific exploratory destination",
          "kind": "example",
          "state": "Owner prioritizes employee continuity, wants to step back in 1\u20133 years, accepts a transition period, and marks liquidity timing as unknown.",
          "expected": "Upper rubric levels are supported while the liquidity unknown remains visible."
        },
        {
          "name": "aspiration without dimensions",
          "kind": "counterexample",
          "state": "Owner says only: I want what is best for everyone.",
          "expected": "Lowest rubric level; the result must not invent goals or timing."
        }
      ],
      "input_contract": {
        "schema_version": "1.0.0",
        "allowed_fields": [
          "desired_outcome.transition_horizon",
          "desired_outcome.employee_ownership_intent",
          "desired_outcome.owner_involvement",
          "desired_outcome.objectives",
          "desired_outcome.nonnegotiables",
          "desired_outcome.preferences",
          "desired_outcome.unknowns"
        ],
        "forbidden_fields": [
          "raw_documents",
          "secrets",
          "credentials",
          "unrelated_personal_identifiers",
          "customer_records"
        ],
        "raw_documents_allowed": false,
        "minimization_policy_id": "jev-minimization-v1",
        "minimization_policy_version": "1.0.0"
      }
    },
    {
      "id": "destination.nonnegotiable_conflict",
      "version": "1.0.0",
      "owner_engine": "Destination",
      "type": "noul",
      "instructions": "Does the proposed preference or scenario state appear to conflict with an explicit owner nonnegotiable?",
      "criteria": {
        "true": "A stated preference, assumption, or path appears incompatible with a hard owner constraint.",
        "false": "No apparent incompatibility with an explicit hard constraint is present."
      },
      "maximum_authority": "signal_only",
      "fallback": "owner_review",
      "consent_purpose": "destination_conflict_evaluation",
      "threshold_policy": "noul-shadow-v1",
      "examples": [
        {
          "name": "explicit continuity conflict",
          "kind": "example",
          "state": "Nonnegotiable: preserve all current jobs. Proposed path assumes immediate elimination of 30% of roles.",
          "expected": "High probability of true; route to owner review without changing either statement."
        },
        {
          "name": "preference is not a hard conflict",
          "kind": "counterexample",
          "state": "Preference: transition within one year. Proposed exploration uses an 18-month assumption and labels the timing mismatch.",
          "expected": "Do not treat a disclosed preference mismatch as an automatic nonnegotiable conflict."
        }
      ],
      "input_contract": {
        "schema_version": "1.0.0",
        "allowed_fields": [
          "desired_outcome.nonnegotiables",
          "proposed_state.assumptions",
          "proposed_state.preferences",
          "proposed_state.disclosed_conflicts"
        ],
        "forbidden_fields": [
          "raw_documents",
          "secrets",
          "credentials",
          "unrelated_personal_identifiers",
          "customer_records"
        ],
        "raw_documents_allowed": false,
        "minimization_policy_id": "jev-minimization-v1",
        "minimization_policy_version": "1.0.0"
      }
    },
    {
      "id": "destination.next_clarification",
      "version": "1.0.0",
      "owner_engine": "Destination",
      "type": "choice",
      "instructions": "Which destination dimension would most improve clarity if the owner addressed it next?",
      "criteria": {
        "timing": "The desired transition timing or pace is unclear.",
        "liquidity": "The owner's liquidity needs or timing are unclear.",
        "control": "The desired post-transition control or involvement is unclear.",
        "employee_outcome": "The intended outcome for employees is unclear.",
        "legacy": "The desired legacy or continuity outcome is unclear.",
        "risk_tolerance": "The owner's tolerance for uncertainty or retained risk is unclear.",
        "professional_review": "The ambiguity requires qualified professional input.",
        "complete": "No material clarification is presently needed."
      },
      "maximum_authority": "human_confirmed",
      "fallback": "owner_review",
      "consent_purpose": "destination_quality_evaluation",
      "threshold_policy": "choice-shadow-v1",
      "examples": [
        {
          "name": "timing is the material unknown",
          "kind": "example",
          "state": "Legacy, employee outcome, control, liquidity, and risk tolerance are stated; no desired timing is present.",
          "expected": "timing"
        },
        {
          "name": "professional issue is not owner clarification",
          "kind": "counterexample",
          "state": "Owner goals are complete; unresolved question is whether a structure qualifies for a tax treatment.",
          "expected": "professional_review, not a fabricated owner preference."
        }
      ],
      "input_contract": {
        "schema_version": "1.0.0",
        "allowed_fields": [
          "desired_outcome.transition_horizon",
          "desired_outcome.employee_ownership_intent",
          "desired_outcome.owner_involvement",
          "desired_outcome.objectives",
          "desired_outcome.nonnegotiables",
          "desired_outcome.preferences",
          "desired_outcome.unknowns"
        ],
        "forbidden_fields": [
          "raw_documents",
          "secrets",
          "credentials",
          "unrelated_personal_identifiers",
          "customer_records"
        ],
        "raw_documents_allowed": false,
        "minimization_policy_id": "jev-minimization-v1",
        "minimization_policy_version": "1.0.0"
      }
    },
    {
      "id": "journey.next_step",
      "version": "1.0.0",
      "owner_engine": "Journey",
      "type": "choice",
      "instructions": "Which caller-supplied permitted next step best reduces the most important unresolved uncertainty?",
      "criteria_source": "runtime_permitted_steps",
      "required_fallback_option": "human_help",
      "maximum_authority": "reversible_route",
      "fallback": "human_help",
      "consent_purpose": "journey_routing",
      "threshold_policy": "choice-shadow-v1",
      "examples": [
        {
          "name": "choose among permitted steps",
          "kind": "example",
          "state": "Permitted steps are clarify_timing, capture_employee_outcome, and human_help. Timing is the only material destination gap.",
          "expected": "clarify_timing when policy gates pass; otherwise human_help."
        },
        {
          "name": "never invent a route",
          "kind": "counterexample",
          "state": "Permitted steps are request_owner_review and human_help. Evidence is missing.",
          "expected": "Do not choose request_evidence because it is not caller-supplied; use a permitted option."
        }
      ],
      "input_contract": {
        "schema_version": "1.0.0",
        "allowed_fields": [
          "journey.current_stage",
          "journey.permitted_steps",
          "journey.deterministic_gate_results",
          "journey.unresolved_uncertainties"
        ],
        "forbidden_fields": [
          "raw_documents",
          "secrets",
          "credentials",
          "unrelated_personal_identifiers",
          "customer_records"
        ],
        "raw_documents_allowed": false,
        "minimization_policy_id": "jev-minimization-v1",
        "minimization_policy_version": "1.0.0"
      }
    },
    {
      "id": "journey.ready_to_advance",
      "version": "1.0.0",
      "owner_engine": "Journey",
      "type": "noul",
      "instructions": "Is sufficient state present to advance from the current journey stage without skipping a mandatory gate?",
      "criteria": {
        "true": "The stage's deterministic gates pass and remaining ambiguity is within the caller-defined tolerance.",
        "false": "Required state is absent, a mandatory gate fails, or material ambiguity remains."
      },
      "maximum_authority": "signal_only",
      "fallback": "remain_in_stage",
      "consent_purpose": "journey_routing",
      "threshold_policy": "noul-shadow-v1",
      "examples": [
        {
          "name": "mandatory gates complete",
          "kind": "example",
          "state": "All deterministic stage gates pass and remaining unknowns are explicitly allowed at this stage.",
          "expected": "High probability of true, used only as a signal."
        },
        {
          "name": "hard gate failure",
          "kind": "counterexample",
          "state": "A mandatory consent gate is false even though the narrative state appears complete.",
          "expected": "False; deterministic gate failure overrides any Jev result."
        }
      ],
      "input_contract": {
        "schema_version": "1.0.0",
        "allowed_fields": [
          "journey.current_stage",
          "journey.deterministic_gate_results",